{
  "title": "13箱体槽钢批量叠切方案 / 13-box channel batch plan",
  "demand": {
    "7150": 4,
    "6545": 4,
    "537": 6,
    "1471": 6,
    "2674": 8,
    "3787": 2,
    "654": 4,
    "7400": 2,
    "2394": 6,
    "2282": 2,
    "2047": 2,
    "5300": 2,
    "2694": 27,
    "5694": 2,
    "1294": 15,
    "1347": 16,
    "6000": 2,
    "5894": 2,
    "8300": 2,
    "6800": 16,
    "6309": 8,
    "847": 10,
    "988": 10,
    "5916": 6,
    "1388": 6,
    "397": 12,
    "2194": 12,
    "7300": 2,
    "7194": 1,
    "3300": 2,
    "1454": 8
  },
  "kerf_mm": 3,
  "stock_lengths_mm": [6000, 9000],
  "max_stack": 6,
  "min_bars": 69,
  "max_bars": 72,
  "baseline_batches": 35,
  "baseline_strokes": 129
}
